{
  "artifactId": "test-artifact-001",
  "artifactType": "technical",
  "createdAtUtc": "2026-02-01T00:00:00Z",
  "tenantId": "federation-public",
  "correlationId": "t:federation-public|c:test-001",
  "actorId": "operator-marketops",
  "sourceRefs": ["github:test/repo#main"],
  "payloadRef": {
    "kind": "file",
    "path": "test/file.txt"
  },
  "destinations": ["federation.systems/site-docs"]
}
